{
    "diagnostics": [],
    "exitCode": 0,
    "results": {
      "files": [
        {
          "cases": [
            {
              "name": "adds",
              "ok": true,
              "outcomes": [
                {
                  "actual": "",
                  "column": 36,
                  "expected": "",
                  "kind": "pass",
                  "label": "adds/toBe",
                  "line": 2
                }
              ],
              "stateHash": "b9fbcb9204a016e2"
            },
            {
              "name": "subtracts",
              "ok": true,
              "outcomes": [
                {
                  "actual": "",
                  "column": 41,
                  "expected": "",
                  "kind": "pass",
                  "label": "subtracts/toEqual",
                  "line": 3
                }
              ],
              "stateHash": "bcbe6422b4a74f28"
            }
          ],
          "failures": [],
          "file": "math.spec.prg",
          "skipped": [],
          "warning": null
        }
      ]
    },
    "schema": "tkr-script-result/1",
    "status": "ok",
    "subcommand": "test",
    "summary": {
      "changed": 0,
      "diagnostics": {
        "error": 0,
        "hint": 0,
        "info": 0,
        "warning": 0
      },
      "failed": 0,
      "files": 1,
      "passed": 2,
      "skipped": 0
    },
    "tool": "tkr"
  }
